{"validation_contract_id":"VC-PROJECT-1","project_id":"PROJECT-1","version":1,"derived_from_requirement_baseline_id":"BL-REQ-1","content_hash":"sha256:aaaaaaaaaaaaaaaaaaaaaaaaaaaaaaaaaaaaaaaaaaaaaaaaaaaaaaaaaaaaaaaa","assertions":[{"assertion_id":"VAL-AUTH-001","scope_type":"CAPABILITY_UNIT","scope_ref":"CU-AUTH","requirement_refs":["REQ-AUTH-1"],"given":"存在一个已注册用户","when":"用户提交有效凭据","then":"系统创建会话并显示工作台","verification_method":"TEST","verifier_capability_ref":"runtime:e2e","required_evidence_types":["TEST_REPORT","SCREENSHOT"],"environment_requirement_refs":["ENV-SIT"],"covered_by_cu_ids":["CU-AUTH"],"severity":"BLOCKING"}],"status":"FROZEN","frozen_by":"operator-1","frozen_at":"2026-08-05T12:00:00Z","created_at":"2026-08-05T11:00:00Z"}
